{
 "schemaVersion": 1,
 "generatedBy": "npm run release:evidence",
 "generatedAt": "2026-10-18",
 "releaseTag": null,
 "releaseCommit": null,
 "evidenceBuiltAtCommit": "e41738af164b8af280adc4aa2f13f2470cfa41cf",
 "artifactGenerationCommit": "a040b3738d359994fbcdd7495a727c95f3ec1ea4",
 "artifactGenerationCommits": [
  {
   "commit": "a040b3738d359994fbcdd7495a727c95f3ec1ea4",
   "assets": [
    "half_plug_topology_profile.v3.trs_jack_trrs.json",
    "half_plug_topology_profile.v3.trs_jack_trs.json"
   ]
  },
  {
   "commit": "d0f3b219e522629ae30e4dbe667738165e63b861",
   "assets": [
    "sensitivity.trs_jack_trrs.json",
    "sensitivity.trs_jack_trs.json",
    "topology-robustness.trs_jack_trrs.json"
   ]
  },
  {
   "commit": "e41738af164b8af280adc4aa2f13f2470cfa41cf",
   "assets": [
    "source-input-manifest.json",
    "source-snapshot.v1.json",
    "source-verification-result.json",
    "test_counts.json",
    "validation-results.json"
   ]
  }
 ],
 "profileSchemaVersion": 3,
 "profileSchemaId": "half-plug-topology-profile.v3",
 "profiles": {
  "TRS|JACK-TRS": {
   "filename": "half_plug_topology_profile.v3.trs_jack_trs.json",
   "profileId": "trs-jack-3d:TRS|JACK-TRS:ab212c62e981",
   "inputDigest": "ab212c62e981489df264207d2f456d970a65a1adac00f8c6f0d42df24bc96111",
   "sha256": "dda82d84894003b62a4afaf12b9c21b265c6c5aee92aab552ba5e14321356b55",
   "generatedFromCommit": "a040b3738d359994fbcdd7495a727c95f3ec1ea4",
   "sensitivityAsset": {
    "filename": "sensitivity.trs_jack_trs.json",
    "sha256": "82b114c7346eb0adabbdbb4f554ec225b879e87161bd89030f0b113709f18c7d",
    "inputDigest": "2edbe129dff891c8ae0500216d98b0134d0a7bd035b7223cffab4cc5a962af0d",
    "generatedFromCommit": "d0f3b219e522629ae30e4dbe667738165e63b861"
   }
  },
  "TRS|JACK-TRRS": {
   "filename": "half_plug_topology_profile.v3.trs_jack_trrs.json",
   "profileId": "trs-jack-3d:TRS|JACK-TRRS:551ad2ad9340",
   "inputDigest": "551ad2ad9340afe88ea801087df4a8a6bf875352c1d5087b0d91d907e22f1497",
   "sha256": "d533be9eab02d421503e715a236e7178348b65bbf13a32ce1edee47f6a9a5e11",
   "generatedFromCommit": "a040b3738d359994fbcdd7495a727c95f3ec1ea4",
   "sensitivityAsset": {
    "filename": "sensitivity.trs_jack_trrs.json",
    "sha256": "47751fb975b06d50dacf8995ce43d50e217364067391e671222b85cbac4b8210",
    "inputDigest": "bb320df496157af2badb246bfb33b9f86fea846c051c90a0e13201607e072c2f",
    "generatedFromCommit": "d0f3b219e522629ae30e4dbe667738165e63b861"
   }
  }
 },
 "assets": [
  {
   "filename": "contract-migration.v1.json",
   "sha256": "f27ce53531e00880146b917e9df9cb0042b0ea63b0a096afcf2108604686b520",
   "role": "evidence"
  },
  {
   "filename": "contract-migration.v1.schema.json",
   "sha256": "5928b45f52b5ed95b568d8538b7e4ea30eec9bbc50781356f9c4dfa83db1e424",
   "role": "schema"
  },
  {
   "filename": "event-sensitivity.v2.schema.json",
   "sha256": "e9cd21c7cb09e496aa9e5609e126493e06871e0bac99cf9dcec79f8d8e7f80ce",
   "role": "schema"
  },
  {
   "filename": "half_plug_topology_profile.v3.trs_jack_trrs.json",
   "sha256": "d533be9eab02d421503e715a236e7178348b65bbf13a32ce1edee47f6a9a5e11",
   "role": "profile",
   "generatedFromCommit": "a040b3738d359994fbcdd7495a727c95f3ec1ea4",
   "inputDigest": "551ad2ad9340afe88ea801087df4a8a6bf875352c1d5087b0d91d907e22f1497",
   "profileId": "trs-jack-3d:TRS|JACK-TRRS:551ad2ad9340"
  },
  {
   "filename": "half_plug_topology_profile.v3.trs_jack_trs.json",
   "sha256": "dda82d84894003b62a4afaf12b9c21b265c6c5aee92aab552ba5e14321356b55",
   "role": "profile",
   "generatedFromCommit": "a040b3738d359994fbcdd7495a727c95f3ec1ea4",
   "inputDigest": "ab212c62e981489df264207d2f456d970a65a1adac00f8c6f0d42df24bc96111",
   "profileId": "trs-jack-3d:TRS|JACK-TRS:ab212c62e981"
  },
  {
   "filename": "half-plug-topology-profile.v3.schema.json",
   "sha256": "d6dc207471e2ddb7bc78d6d39dab43fff5063e067ff183b7b8dcecd8c7ef7433",
   "role": "schema"
  },
  {
   "filename": "real-jack-comparison.v1.schema.json",
   "sha256": "24d85873781f23c9f81da25676cbf98c2b9ea5a0de90a81275f936e5f4a93be4",
   "role": "schema"
  },
  {
   "filename": "release-stage-attestation.v1.schema.json",
   "sha256": "fb8cb735769eb11aaaad26404c17f47807a6e2a9047889b2c9be9f2bc25b25f5",
   "role": "schema"
  },
  {
   "filename": "sensitivity.trs_jack_trrs.json",
   "sha256": "47751fb975b06d50dacf8995ce43d50e217364067391e671222b85cbac4b8210",
   "role": "sensitivity",
   "generatedFromCommit": "d0f3b219e522629ae30e4dbe667738165e63b861",
   "inputDigest": "bb320df496157af2badb246bfb33b9f86fea846c051c90a0e13201607e072c2f"
  },
  {
   "filename": "sensitivity.trs_jack_trs.json",
   "sha256": "82b114c7346eb0adabbdbb4f554ec225b879e87161bd89030f0b113709f18c7d",
   "role": "sensitivity",
   "generatedFromCommit": "d0f3b219e522629ae30e4dbe667738165e63b861",
   "inputDigest": "2edbe129dff891c8ae0500216d98b0134d0a7bd035b7223cffab4cc5a962af0d"
  },
  {
   "filename": "source-input-manifest.json",
   "sha256": "c7854dff454fbf82b4ce51e2685618f55f8da8a4a0044f94e96e68ea5a4c259a",
   "role": "evidence",
   "generatedFromCommit": "e41738af164b8af280adc4aa2f13f2470cfa41cf"
  },
  {
   "filename": "source-input-manifest.v2.schema.json",
   "sha256": "06a26fe4ed66d91e64a6a7ec39649028e5148701681c02842e8e641865ca8358",
   "role": "schema"
  },
  {
   "filename": "source-input-scope.v1.json",
   "sha256": "ba7a855da4a06cd05f99a5387ab6537d741339d2b6c3aa86b06bd4454161dd43",
   "role": "evidence"
  },
  {
   "filename": "source-input-scope.v1.schema.json",
   "sha256": "607b7f6ce9c39500e2f479941ae723d04ae761047ec1ba68ed4f0b84b0b2b2a6",
   "role": "schema"
  },
  {
   "filename": "source-snapshot.v1.json",
   "sha256": "95457859178a516a879c5189d15ad3d01158b9535f9ef7e1012e9635799adec5",
   "role": "evidence",
   "generatedFromCommit": "e41738af164b8af280adc4aa2f13f2470cfa41cf"
  },
  {
   "filename": "source-snapshot.v1.schema.json",
   "sha256": "046cc9177d15a2e4d7d1f604d4844784a245761b866e636ec22178548e9afd61",
   "role": "schema"
  },
  {
   "filename": "source-verification-result.json",
   "sha256": "981d19394710022c0f3201227c5e932eb05dab3e1ec4c5ec5da553ea81e96ffe",
   "role": "evidence",
   "generatedFromCommit": "e41738af164b8af280adc4aa2f13f2470cfa41cf"
  },
  {
   "filename": "source-verification-result.v1.schema.json",
   "sha256": "95e344b76f6c823266cf597606dbf1d3e85dd78e489499ca4ad7e8c185b9ae0b",
   "role": "schema"
  },
  {
   "filename": "source-verifier-cli-result.v2.schema.json",
   "sha256": "0aea97c50b146bf730d82252a8f62ffe63c10d8cb6d93d5f337f9e127ffcca90",
   "role": "schema"
  },
  {
   "filename": "test_counts.json",
   "sha256": "5f7200ee7658ed4c55028334827b0f7ec2b4e770d2debf7725c6da4666808a9b",
   "role": "evidence",
   "generatedFromCommit": "e41738af164b8af280adc4aa2f13f2470cfa41cf"
  },
  {
   "filename": "test-counts.v2.schema.json",
   "sha256": "23199aa88003c6e6fc36b7a52ef8aa9e48fcfe907eb5e473c7af7c03fa5ac37d",
   "role": "schema"
  },
  {
   "filename": "topology-robustness.trs_jack_trrs.json",
   "sha256": "a5bd6c22a41523a142e28f4b3b7728ef9dfb661a10e93119611b38869b50fada",
   "role": "robustness",
   "generatedFromCommit": "d0f3b219e522629ae30e4dbe667738165e63b861",
   "inputDigest": "3a043430a5f34cf5e95037e6bdc2145384fdd3ba2d0666f39659f7a2c01a53eb"
  },
  {
   "filename": "topology-robustness.v3.schema.json",
   "sha256": "10ec667f043c2c65a017ae3ae2ed2765679a90026eb450d59fb02f4bc70bd1c3",
   "role": "schema"
  },
  {
   "filename": "topology-search.v1.schema.json",
   "sha256": "d7904318a00cd842b9d780bd84fd0e40fd8634a4dc6844ed1c7ec6fa9eff9c4f",
   "role": "schema"
  },
  {
   "filename": "trs-jack-3d-release-index.v1.schema.json",
   "sha256": "b986b063677905b7d1edae3f18e7b8aace61c5ee833c53b059640a34d73e88f9",
   "role": "schema"
  },
  {
   "filename": "validation-results.json",
   "sha256": "80c49b87e0a4fc198e80cb84aaf9ee4f5eac53047cb29d8304d84acc4444fdc1",
   "role": "evidence",
   "generatedFromCommit": "e41738af164b8af280adc4aa2f13f2470cfa41cf"
  },
  {
   "filename": "validation-results.v3.schema.json",
   "sha256": "b599e383a170484790d8762fecb9bc9e26572a4ccd99c19e5f6492db188237f6",
   "role": "schema"
  },
  {
   "filename": "verifyReleaseSourceInputs.mjs",
   "sha256": "da1e5558d0a4cdf38c23274c4486bbbbf94cc79bf02a28a49cd01765af325401",
   "role": "tool"
  }
 ],
 "notes": [
  "**この索引は release 工程の記録であって、証明ではない。**bytes の検算は SHA256SUMS で行うこと。",
  "**検算ツールの契約**（この形にしたのは v0.6.16）。**信頼の起点は assets の verifyReleaseSourceInputs.mjs の sha256（da1e5558d0a4cdf38c23274c4486bbbbf94cc79bf02a28a49cd01765af325401 ／ toolVersion 20）。",
  "**保存した検算結果は、この版と一緒に配った source-verifier-cli-result.v2.schema.json （assets の sha256）で検証すること。**$id から最新版を引くと、後の版で狭めた分だけ過去の結果が落ちる（docs/SCHEMA_VERSIONING_POLICY.md 第7条）。",
  "**受け手が固定すべき配布物**（`assets[]` の filename と sha256 を lock すること）: half_plug_topology_profile.v3.trs_jack_trs.json / half_plug_topology_profile.v3.trs_jack_trrs.json / source-verifier-cli-result.v2.schema.json / source-input-manifest.json / verifyReleaseSourceInputs.mjs。**この `notes` の文そのものは機械契約ではない**——分岐に使わないこと。",
  "**archivePolicy の識別子**: trs-jack-3d-source-verifier-archive-policy v1 / policySha256 41adcd453574c3b3d03af2dd98e289a3075af86ad6201b8c39281cb476f226d3。**自己整合の識別子であって、真正性の証明ではない**——同じ道具が policy と digest の両方を書くので、両方書き換えれば一致する。",
  "**`releaseTag` / `releaseCommit` が null なら、まだ tag を打っていない。**evidence をコミットしてから tag を打つ順序なので、生成時点では知りようがない。配布物には RELEASE_TAG / RELEASE_COMMIT を渡して作り直したものを入れること（release:stage が null を拒む）。",
  "**`releaseCommit` と `artifactGenerationCommit` は違う。**tag は artifact をコミットした後に打つので、artifact 自身は必ずそれより前の commit から作られる。一致を要求しないこと。",
  "**生成 commit は 1 つではない**（`artifactGenerationCommits` を見ること）。release 工程が 2 段階で、profile の入力に感度 artifact が含まれるため、先に感度を確定させる必要がある。",
  "**この索引自身の sha256 はここに無い**（自己参照になる）。SHA256SUMS が持っている。"
 ]
}
